<?xml version="1.0" encoding="ISO-8859-1" standalone="yes"?>
<!DOCTYPE doc SYSTEM "../../clonk.dtd">
<?xml-stylesheet type="text/xsl" href="../../clonk.xsl"?>
<doc>
<title>Basisfunktionalitäten</title>
<h id="BaseFunc">Basisfunktionalitäten</h>
<text>Die BaseFunctionality-Option (DWord-Bitmaske) eines Szenarios bestimmt, welche Funktionen eine Basis (Gebäude mit Spielerflagge) in einem Szenario erfüllen kann.</text>
<text>
<table><rowh>
	<col>Bit</col><col>Wert</col><col>BaseFunctionality</col><col>Beschreibung</col>
</rowh><row>
	<col>0</col><col>1</col><col>BASEFUNC_AutoSellContents</col><col>Loren werden ausgeleert und Gold wird aus der Basis und direkt enthaltenen Objekten verkauft.</col>
</row><row>
	<col>1</col><col>2</col><col>BASEFUNC_RegenerateEnergy</col><col>Verbündete Clonks regenerieren in der Basis Energie.</col>
</row><row>
	<col>2</col><col>4</col><col>BASEFUNC_Buy</col><col>Objekte können in der Basis gekauft werden.</col>
</row><row>
	<col>3</col><col>8</col><col>BASEFUNC_Sell</col><col>Objekte können in der Basis verkauft werden.</col>
</row><row>
	<col>4</col><col>16</col><col>BASEFUNC_RejectEntrance</col><col>Gegnerischen Clonks wird das Öffnen des Eingangs verwehrt.</col>
</row><row>
	<col>5</col><col>32</col><col>BASEFUNC_Extinguish</col><col>Clonks werden in der Basis gelöscht.</col>
</row><row>
	<col>1-16</col><col>65536</col><col>BASEFUNC_Default</col><col>Alle Bits gesetzt: Standardverhalten für Basis.</col>
</row>
</table>
</text>
<author>Sven2</author><date>März 2006</date>
</doc>
