<?xml version="1.0" encoding="UTF-8" standalone="yes"?>
<!DOCTYPE funcs
  SYSTEM '../../../clonk.dtd'>
<?xml-stylesheet type="text/xsl" href="../../../clonk.xsl"?>
<funcs>
  <const>
    <title>C4D_All</title>
    <category>Objects</category>
    <subcat>Category</subcat>
    <version>1.0 OC</version>
    <syntax><rtype>int</rtype></syntax>
    <desc>Object category: all categories.</desc>
    <related>
      <funclink>GetCategory</funclink>
      <funclink>SetCategory</funclink>
    </related>
  </const>
  <author>Sven2</author><date>2002-01</date>
</funcs>
