<?xml version="1.0" encoding="UTF-8" standalone="yes"?>
<!DOCTYPE funcs
  SYSTEM '../../../clonk.dtd'>
<?xml-stylesheet type="text/xsl" href="../../../clonk.xsl"?>
<funcs>
  <func>
    <title>Sort_Mass</title>
    <category>Objects</category>
    <subcat>Search</subcat>
    <version>1.0 OC</version>
    <syntax><rtype>array</rtype></syntax>
    <desc>Sort criterion: Sorts the found objects by their mass. The lightest objects first.</desc>
    <remark>For additional information on the use of this function see <funclink>FindObjects</funclink>.</remark>
    <related><funclink>FindObjects</funclink></related>
  </func>
  <author>Newton</author><date>2009-07</date>
</funcs>
