<?xml version="1.0" encoding="ISO-8859-1" standalone="yes"?>
<!DOCTYPE funcs SYSTEM "../../../clonk.dtd">
<?xml-stylesheet type="text/xsl" href="../../../clonk.xsl"?>
<funcs>
	<func>
		<title>VIS_Enemies</title>
		<category>Objekte</category><subcat>Sichtbarkeit</subcat>
		<version>4.9.1.0 GWE</version>
		<syntax>
			<rtype>int</rtype>
		</syntax>
		<desc>Konstante für <funclink>GetVisibility</funclink>/<funclink>SetVisibility</funclink>. Das Objekt ist für alle Feinde des Besitzers sichtbar.</desc>
		<remark>Dieser Wert ist als Engine-Konstante definiert. Die Funktionsklammern können daher optional weggelassen werden.</remark>
		<examples>
			<example>

<code>for(var obj in FindObjects(Find_Or(Find_ID(BANR),Find_ID(BANP)))) SetVisibility(VIS_Enemies | VIS_God, obj);
</code>

				<text>Alle Banner sind nur noch für die jeweiligen Gegner der besitzenden Spieler sichtbar.</text>
			</example>
		</examples>
		<related>
			<funclink>GetVisibility</funclink>
			<funclink>SetVisibility</funclink>
			<funclink>VIS_All</funclink>
			<funclink>VIS_None</funclink>
			<funclink>VIS_Owner</funclink>
			<funclink>VIS_Allies</funclink>
			<funclink>VIS_God</funclink>
			<funclink>VIS_Local</funclink>
		</related>
	</func>
	<author>Sven2</author><date>November 2001</date>
</funcs>
