<?xml version="1.0" encoding="UTF-8" standalone="yes"?>
<!DOCTYPE funcs
  SYSTEM '../../../clonk.dtd'>
<?xml-stylesheet type="text/xsl" href="../../../clonk.xsl"?>
<funcs>
  <func>
    <title>GetPlrKnowledge</title>
    <category>Player</category>
    <version>5.1 OC</version>
    <syntax>
      <rtype>int</rtype>
      <params>
        <param>
          <type>int</type>
          <name>player</name>
          <desc>Player whose construction plans you want to determine.</desc>
        </param>
        <param>
          <type>id</type>
          <name>id</name>
          <desc>If specified, the function returns true, if the player has the construction plan of the specified object.</desc>
          <optional />
        </param>
        <param>
          <type>int</type>
          <name>index</name>
          <desc>Specify only if id is not 0.</desc>
          <optional />
        </param>
        <param>
          <type>int</type>
          <name>category</name>
          <desc>Specify only if id is not 0.</desc>
          <optional />
        </param>
      </params>
    </syntax>
    <desc>With id specified the function returns true if the player has the construction plan of the specified object. In this case index and category are ignored. If id is 0, the function returns the indicated construction plan of the specified category.</desc>
    <examples>
      <example>
        <code><funclink>if</funclink>(GetPlrKnowledge(0,WindGenerator))
	<funclink>Log</funclink>(&quot;Player %s can construct a %s&quot;,<funclink>GetPlayerName</funclink>(0),WindGenerator-&gt;<funclink>GetName</funclink>());</code>
        <text>Displays a message if the first player has the construction plan for wind generators.</text>
        <code>var def = GetPlrKnowledge( 0,nil,4,<funclink>C4D_Structure</funclink>);
<funclink>Log</funclink>(&quot;The fifth construction plan of the first player is for ID "%i"&quot;,def);</code>
        <text />
      </example>
    </examples>
    <related>
      <funclink>SetPlrKnowledge</funclink>
      <funclink>C4D_All</funclink>
      <funclink>C4D_Goal</funclink>
      <funclink>C4D_Living</funclink>
      <funclink>C4D_Object</funclink>
      <funclink>C4D_Rule</funclink>
      <funclink>C4D_StaticBack</funclink>
      <funclink>C4D_Structure</funclink>
      <funclink>C4D_Vehicle</funclink>
    </related>
  </func>
  <author>GÃ¼nther</author><date>2002-02</date>
</funcs>
