<?xml version="1.0" encoding="ISO-8859-1" standalone="yes"?>
<!DOCTYPE funcs SYSTEM "../../../clonk.dtd">
<?xml-stylesheet type="text/xsl" href="../../../clonk.xsl"?>
<funcs>
	<func>
		<title>SetVisibility</title>
		<category>Objekte</category><subcat>Sichtbarkeit</subcat>
		<version>4.9.1.0 GWE</version>
		<syntax>
			<rtype>bool</rtype>
			<params>
				<param><type>int</type><name>dwVisibility</name>
					<desc>
						Bitmaske, die die neue Sichtbarkeit angibt.<br />
						Entweder <funclink>VIS_All</funclink> oder <funclink>VIS_None</funclink>, oder eine Bitmaske aus <funclink>VIS_Owner</funclink>, <funclink>VIS_Allies</funclink>, <funclink>VIS_Enemies</funclink>, <funclink>VIS_God</funclink> und <funclink>VIS_Local</funclink>.
					</desc>
				</param>
				<param><type>object</type><name>obj</name><desc>Objekt, dessen Sichtbarkeit geändert werden soll. 0 bei lokalem Aufruf.</desc><optional /></param>
			</params>
		</syntax>
		<desc>
			Verändert die Sichtbarkeit eines Objekts. Objekte können für beliebige Gruppen sichtbar gemacht werden, indem für dwVisibility eine Bitmaske angegeben wird.
		</desc>
		<examples>
			<example>
				<code>SetVisibility(<funclink>VIS_None</funclink>(), <funclink>GetCursor</funclink>())</code>
				<text>Macht den ausgewählten Clonk von Spieler 0 völlig unsichtbar.</text>
			</example>
			<example>
				<code>SetVisibility(<funclink>VIS_Owner</funclink>() | <funclink>VIS_Allies</funclink>(), <funclink>GetCursor</funclink>())</code>
				<text>Macht den ausgewählten Clonk von Spieler 0 nur für sich und Verbündete sichtbar.</text>
			</example>
		</examples>
		<related>
			<funclink>GetVisibility</funclink>
			<funclink>CheckVisibility</funclink>
			<funclink>VIS_All</funclink>
			<funclink>VIS_None</funclink>
			<funclink>VIS_Owner</funclink>
			<funclink>VIS_Allies</funclink>
			<funclink>VIS_Enemies</funclink>
			<funclink>VIS_God</funclink>
			<funclink>VIS_Local</funclink>
		</related>
	</func>
	<author>Sven2</author><date>November 2001</date>
</funcs>
