<?xml version="1.0" encoding="UTF-8" standalone="yes"?>
<!DOCTYPE funcs
  SYSTEM '../../../clonk.dtd'>
<?xml-stylesheet type="text/xsl" href="../../../clonk.xsl"?>
<funcs>
  <func>
    <title>GetYDir</title>
    <category>Objects</category>
    <subcat>Movement</subcat>
    <version>1.0 OC</version>
    <syntax>
      <rtype>int</rtype>
      <params>
        <param>
          <type>int</type>
          <name>precision</name>
          <desc>Precision with which to retrieve the speed. Default value is 10.</desc>
        </param>
      </params>
    </syntax>
    <desc>Returns the vertical speed of the calling object.</desc>
    <remark>The function will return the speed in pixels per frame multiplied with precision. If no precision is specified, the ten-fold speed value will be returned.</remark>
    <related>
      <funclink>GetXDir</funclink>
      <funclink>SetXDir</funclink>
      <funclink>SetYDir</funclink>
      <funclink>GetX</funclink>
      <funclink>GetY</funclink>
      <funclink>SetPosition</funclink>
    </related>
  </func>
  <author>Cucaracha</author><date>2002-05</date>
</funcs>
