<?xml version="1.0" encoding="UTF-8" standalone="yes"?>
<!DOCTYPE funcs
  SYSTEM '../../../clonk.dtd'>
<?xml-stylesheet type="text/xsl" href="../../../clonk.xsl"?>
<funcs>
  <const>
    <title>OCF_Available</title>
    <category>Objects</category>
    <subcat>OCF</subcat>
    <version>1.0 OC</version>
    <syntax><rtype>int</rtype></syntax>
    <desc>Object character flag: this object can theoretically be acquired by a clonk, meaning it is either uncontained or in a container to which the clonk can have access.</desc>
    <remark>For more information and examples regarding these constants see <emlink href="definition/ocf.html">object character flags</emlink>.</remark>
    <related>
      <funclink>GetOCF</funclink>
      <funclink>FindObject</funclink>
      <emlink href="definition/ocf.html">Object character flags</emlink>
    </related>
  </const>
  <author>Sven2</author><date>2002-05</date>
</funcs>
